{
  "document_id": "doc_002",
  "document_hash": "9a363e8f0a6e089f",
  "document_type": "factura",
  "source_file": "2b CANDADOS DE SEGURIDAD.PDF",
  "processing_timestamp": "2025-08-12 16:29:12.191169",
  "raw_data": {
    "text": "TRANSPORTES MEDINA\nm\nTel. 443 727 88 01 Correo electrónico: cossmedinahectorhugo@gmail.com\nFrancisco I. Madero 146, Lazaro Cardenas, C.P. 60950 05 de Mayo 2025\nHDI Seguros, S.A. de C.V. At'n: Área de Siniestros\nPresente\nPor medio de la presente, hago constar que en el embarque correspondiente al siniestro reportado bajo la póliza No. 141- 2346 inciso 1, con fecha de 26 de F, la unidad que transportaba la mercancía fue asegurada mediante un candado foleado numerado 000121, como medida preventiva de seguridad.\nDicho candado fue colocado al inicio de la ruta en la caja metálica donde se encontraba la mercancía, asegurando que no se pudiera abrir sin romper dicho elemento. Esta acción fue adoptada con el objetivo de garantizar el resguardo de la carga durante el trayecto.\nA continuación, se anexa fotografía del candado utilizado, así como el número de folio correspondiente:\nFolio del candado: 000121\nFotografía anexa del candado colocado\nSEALED\n000121\nHH 05 GO HH\nSin otro particular, agrade...",
    "entities": [
      {
        "type": "moneda",
        "value": "05"
      },
      {
        "type": "moneda",
        "value": "2025"
      },
      {
        "type": "moneda",
        "value": "2346"
      },
      {
        "type": "moneda",
        "value": "146,"
      },
      {
        "type": "moneda",
        "value": "60950"
      },
      {
        "type": "moneda",
        "value": "1,"
      },
      {
        "type": "moneda",
        "value": "443"
      },
      {
        "type": "moneda",
        "value": "727"
      },
      {
        "type": "moneda",
        "value": "26"
      },
      {
        "type": "moneda",
        "value": "88"
      }
    ],
    "key_value_pairs": {
      "tel.": "443 727 88 01",
      "correo_electrónico": "cossmedinahectorhugo@gmail.com",
      "at'n": "Área de Siniestros",
      "folio_del_candado": "000121",
      "fotografía_anexa_del_candado_colocado": "HH 05 GO HH"
    },
    "specific_fields": {}
  },
  "extracted_fields": {
    "folio": ""
  },
  "validation_results": {
    "has_rfc": false,
    "has_total": false,
    "has_date": false
  },
  "memory_usage_mb": 0.0,
  "processing_time_ms": 0.093
}